PassengerId,Pclass,Name,Sex,Age,SibSp,Parch,Ticket,Fare,Cabin,Embarked
914,1,"Flegenheim, Mrs. Alfred (Antoinette)",female,,0,0,PC 17598,31.6833,,S
915,1,"Williams, Mr. Richard Norris II",male,21,0,1,PC 17597,61.3792,,C
916,1,"Ryerson, Mrs. Arthur Larned (Emily Maria Borie)",female,48,1,3,PC 17608,262.375,B57 B59 B63 B66,C
917,3,"Robins, Mr. Alexander A",male,50,1,0,A/5. 3337,14.5,,S
918,1,"Ostby, Miss. Helene Ragnhild",female,22,0,1,113509,61.9792,B36,C
919,3,"Daher, Mr. Shedid",male,22.5,0,0,2698,7.225,,C